Anonymized Message,Valence1,Valence2,Arousal1,Arousal2
"All night with <PERSON> and <PERSON> at <PERSON> to see Combichrist.  FUCK I LOVED THE SHOW.  Absolutely need to pass out, long work week + six hour concert = TIRED AS SHIT",5,7,5,6
manu sailing smoothly :),6,7,3,3
"hot, scared, nd a lil sweaty.  all in all it was a good day.",6,6,2,1
"I'm stronger because of my hard times, wiser because of my mistakes, happier because of my sad experiences, and smarter because of my moments of confusion",7,7,2,1
hi everyone i have nothing to say so i will say hi everyone,5,5,3,1
"I've got a soul that cannot sleep\ ! :D\""""",6,6,5,4
"just got home, had a fun time running today",6,6,2,1
"If you died today, who would be taking care of the arrangements and would he or she be paying for it...that is what is on my mind.  Due to my new profession, I am currently welcoming any and all death jokes (okay, maybe not all, I would rather not have my",5,5,2,1
is bored and many going to start her science project,5,4,1,1
"had a great time at the wedding! Yankees up 2-0, big game tonight i'm nervous as hell! i wanna spank that damn rally monkey tonight!",6,7,6,5
We begin from the recognition that all beings cherish happiness and do not want suffering. It then becomes both morally wrong and pragmatically unwise to pursue only one's own happiness oblivious to the feelings and aspirations of all others who surround us as members of the same human family. The wiser course is to think of others when pursuing our own happiness.,5,6,2,1
Sleepy,5,5,1,1
"loving myself is simple, but letting someone else love u is so hard.",4,4,2,1
"1 final down, 1 to go!",5,6,5,4
4 days til Indiana:),7,7,2,2
there is a fine thin line between wrong and right.,5,5,2,1
Happy Thanksgiving,7,5,2,1
<PERSON> u have issuse lmao,5,6,3,2
this is how you remind me,5,5,1,1
down in MD in my sis.. with a big cockatoo on my hand.. while typing.. had a great day with our cousin.. wish I never had to go back to work.. dreams.. dreams.. oh and we got<PERSON>.. yippe!,7,7,5,3
drama...drama...and more drama....I am done!,4,4,6,5
"Ughhh, I wish I could stop coughing already! Being sick is horrribllleee. About to watch some television with<PERSON> then falll asleeepp. :) <3",4,7,3,4
Ind Vs Srilanka - A Thrilling match in progress....India need 65 ..5 wickets in hand..,5,5,3,2
needs a lobotomy!,4,5,6,4
"In the land of the blinds, One eye man is a king.",5,5,1,1
had my gps for less than a day and I already broke it. Good thing Garmin is nice and going to send me a brand new one.,6,5,2,1
Do you ever feel like you have a lot of people in your life but very few who understand you?,4,4,2,2
i laugh again why the fuck was i upset in the first place i wasnt even shocked wow im so over that :) i am very happy today it was just ordinary day again,6,8,3,3
"Ã¢â€¢â€Ã¢â€¢ÂÃ¢â€¢ÂÃ¢â€¢ÂÃ¢â€¢ÂÃ¢â€¢ÂÃ¢â€¢ÂÃ¢â€¢ÂÃ¢â€¢ÂÃ¢â€¢ÂÃ¢â€¢ÂÃ¢â€¢ÂÃ¢â€¢ÂÃ¢â€¢ÂÃ¢â€¢Â Ã Â³â€¹Ã¡Æ’Â¦Ã¢ËœÆ’Ã¡Æ’Â¦Ã Â³â€¹ Ã¢â€¢ÂÃ¢â€¢ÂÃ¢â€¢ÂÃ¢â€¢ÂÃ¢â€¢ÂÃ¢â€¢ÂÃ¢â€¢ÂÃ¢â€¢ÂÃ¢â€¢ÂÃ¢â€¢ÂÃ¢â€¢ÂÃ¢â€¢ÂÃ¢â€¢ÂÃ¢â€¢ÂÃ¢â€¢ÂÃ¢â€¢ÂÃ¢â€¢â€”	It's Sons Week! If you have a beautiful son or sons that you	love more than you can describe, copy and paste this to your	status for a little while, but hold them in your heart for a lifetime	Ã¢â€¢Å¡Ã¢â€¢ÂÃ¢â€¢ÂÃ¢â€¢ÂÃ¢â€¢ÂÃ¢â€¢ÂÃ¢â€¢ÂÃ¢â€¢ÂÃ¢â€¢ÂÃ¢â€¢ÂÃ¢â€¢ÂÃ¢â€¢ÂÃ¢â€¢ÂÃ¢â€¢ÂÃ¢â€¢Â Ã Â³â€¹Ã¡Æ’Â¦Ã¢ËœÆ’Ã¡Æ’Â¦Ã Â³â€¹ Ã¢â€¢ÂÃ¢â€¢ÂÃ¢â€¢ÂÃ¢â€¢ÂÃ¢â€¢ÂÃ¢â€¢ÂÃ¢â€¢ÂÃ¢â€¢ÂÃ¢â€¢ÂÃ¢â€¢ÂÃ¢â€¢ÂÃ¢â€¢ÂÃ¢â€¢ÂÃ¢â€¢ÂÃ¢â€¢Â",6,7,4,4
Today has to be the most boring day of this entire summer hands down. :/,4,3,2,4
Happy Happy Happy !!!!,7,9,7,7
Relationships are like glass. Sometimes it is better to leave them broken than try to hurt yourself putting it back together......:),5,6,3,2
uhhh! this homework! its killing me.,4,3,5,5
Thanks so much for the birthday wishes everyone!!,7,6,6,5
I hope I get my voice back before saturday.,5,5,2,1
"I am perfectly imperfect, beautiful in my flaws, sure of my insecurities, absolute chaos..a beautiful disaster",5,7,2,3
of course not! youre brain washed!,5,4,5,5
school is so boring is it to early to want it to be spring break,4,4,2,1
"Miss <PERSON> (as I hand out the new spelling lists): Don't lose your spelling lists because there are no more copies of these bad boys.\  Class (whispers and head bobbing): \""Bad boys""",5,5,2,1
I'd very much like some peach pie or peach cheesecake right now.  Somebody make this happen plz.,5,5,2,1
Common tests are 0000vvverrrrrrrr :DDDDDDD,6,8,4,7
Almost feeling better!! damit hurry up already with this cold!!! so I can drink this weekend!!,6,6,5,7
Gonna clean out my car today... maybe they will take it as a trade in later this week.. maybe not,5,5,1,1
"in brawl the two excuses my brother uses after he loses is im not even trying\ and \""you got lucky\"".\""""",5,4,2,1
3hrs  2 go n then im 14,5,5,1,1
think am falling in love with Mauritius ...and its cultural diversity..,5,6,1,3
is looking forward to great weather & some waves for wednesday,6,7,2,1
"when you got nothin', you got nothin' to lose.",6,5,2,1
"can't sleep, again.",4,4,1,1
Ã¢â„¢Â«i'm doing this for me so **** the whole universe!Ã¢â„¢Â« :),4,7,4,5
SOUTHERN HOSPITALITY! AIN'T NOTHING LIKE IT! EXCEPT NO SUBSTITUTES! LIVE AND LOVE IT!,6,8,8,9
would love to go back to bed.,5,4,1,1
"i'm gonna stick through all my plans for now on, nothing and no body is gonna keep me away from thats!!",6,6,6,5
Happy 4Th of July! See you girls tomorrow!xo,6,6,6,5
Is in a slipknot mood >:o,5,5,2,4
"is... HAPPY BIRTHDAY, ADAM!!! and ha ha ha, FSU :p......",6,7,7,8
just spent her day at the beach (:,6,7,4,2
Did you know that you can make scrambled egg in the microwave? Bachelor tip #77.,6,5,2,2
What do you know? The first post I see on MLIA is about Harry Potter. MLIA.,5,5,1,1
"If the answer lies within, then why is there confusion? Are we blinded, deaf, or just ignorant to the inner voice?",4,3,2,3
<PERSON>add me on xbox live !,5,5,6,4
Thank you all who wished me a Happy Birthday..Definatly had a good one  to jump start the year just right! Hope everyone had a Bangin' New Year and God bless all,8,7,4,4
"I have really found it difficult sometimes to be the person that GOD wants me to become. Its a shame that the people who should be supportive are the ones who try their best to tear you down. I changed me to make other people feel better when it was never about them. Always remember that when dealing with GOD, OBEDIENCE IS BETTER THAN SACRIFICE!!!\\""""",4,4,5,8
"you played me till i left, now theirs nobody left to hear your complaining-- im gone. and all your hearing is your own damn echoes, and im gone and your all alone hearin your own damn echoes. disgusted with trust, ill trust no one no more. just went with the flo, found myself on the floor.",3,2,2,1
got my learners permit thursday. ha i forgot to post it then x] its totally sweet. i cant wait until my mom puts me on her insurence so i can drive all around tulsa!,6,7,5,4
LIFE HAS NEVER BEEN BETTER!!!!!!!,7,9,8,9
lost his damn phone ...,4,4,3,3
"ITS HIGH TIME I ADDED PPL I WANT TO ,TO MY FRIEND LIST.",5,5,3,5
Alright long day at school!! Now its time to run jum hurdle and climb!! Goddamn I love Parkour!!,7,8,7,8
"Glad to see everyone is finding their families\.\""""",6,5,2,1
Love is gigantic and unspoken.LOVE IS BLIND BUT WE ARE NOT BLIND,5,6,4,5
"i'm a supergirl, and supergirls don't cry...or do they? or am i not a supergirl at all??",5,4,2,4
LYL,5,5,1,1
Help!! I'm trapped in the conference call that will never end!  Rounding hour 3.,4,4,4,5
new music,5,5,1,1
About to go to a movie wit charolatte lol,6,6,3,1
ggfdfdfdfdf,5,5,1,3
the third crossroad must be the most difficult.... hold on to the memories or let go to start anew?,5,4,1,2
"I'm having a bad I miss <PERSON> day\. For no reason...nothing triggered it...kids aren't driving me too crazy. I just miss his laugh""",4,2,2,2
good bye grandma.. i hope u reach a better place.. we love u.. :'(,3,2,2,3
Misses <PERSON>,4,5,2,1
I want 2 thank everyone 4 wishingme a happy bday...luv u guys,6,8,3,2
in need of insects cant bye any yeat,4,5,1,1
they said it would't be easy... but no one told me it would be this hard...,4,3,2,2
"PEACE I can picture in my minds eye a world without conflict, a world without war. Then I can picture us attacking it, because they would never expect it! \\^/",4,4,3,4
Definitely absolutely doubting the certainty,4,5,1,2
Interesting video for a man with butter fingers.,5,5,1,1
Many blessings to you all on this HOT Monday!,6,7,4,5
Cmon Arsenal!! It's now or never..show them wat we are made off...,6,6,5,5
i hate the way she smile. so plastic! so stupid and yet so pathetic. CHAR!,3,1,6,6
"Dare to take chances.,)",7,7,3,3
This day could not possibly get any worse! :/,3,2,4,5
Real Pirate Wenches suck c0ck like it's gunna cum rum!,4,4,5,5
is ready for delicious Christmas cookies a la Lexi!,6,6,4,5
cuddling with lukas in my bed hes so fluffly!!! but only if.....,5,6,6,6
Well no final decision til the 26th....=( judge got pissed off and told us hed had enough....,3,3,3,4
back to the way things are suppose to be,5,6,2,1
well orlando couldnt come through but its all good tomorrow starts a new fun filled week of work,4,4,2,1
phone blowed up today need phone numbers please,4,5,1,1
Can't find wat I'm lookin for,4,4,2,1
is bye bye wisdom teeth!!,5,5,5,5
Hey yall. I'm going to tennis camp tommorow.,5,5,3,1
"sitting next to her,watching her smile,talk,laugh,kiss,hug makes me feels stronger and warmth. is as if half my life belongs to her. finally,we meet again.. after so long you've been missing from my view.. im ready to take to the next level.. it may take lots of consequences but for the sake of love and trying,i will try. you are my drug, and my only personal brand of heroin.",7,8,2,3
"Netflix movies that arrived today: Fool's Gold\ and \""Definitely""",5,5,1,1
IT'S 7:00 AM I'M UP WATCHING CSI MIAMI (FAV SHOW),6,6,4,5
Thanks for all the wonderful Birthday Wishes!  I am having a great day with my most precious gift ever!!,7,8,7,6
going to get my husband going to get my husband !!!! I LOVE FRIDAYS but i sure do hate sunday nights :(,4,7,8,7
i cant seem to escape the neonatal vehicle,4,5,2,1
Thank you for the birthday wishes! :),6,7,5,5
:'(,3,2,1,4
Insomnia again...I'm too tired to sleep...my head aches....I feel beat up...,4,3,1,2
"At last, the sun is beginning to set later.  4:43 yesterday; 4:44 today.",5,5,2,1
I love life,6,9,1,1
"I have made an observation: the more senior the person, the more smartly dressed they are during the day, but interestingly, the more casually dressed they are in the evening.",5,5,2,1
Fake(+)(+) Perfect (o)(o) Perky (*)(*) Cold (^)(^) and even Grandma's \\./\\./ Big ( o )( o ) or Small (.)(.) Save them all! Repost for Breast Cancer Awareness!,6,6,4,4
Holiday world is going to be a beast,6,4,3,1
i'm not aloud to touch my cats kittens yet :'(,4,3,2,4
Had a great birthday with friends and had lots of fun and wish it never would have ended.,7,7,2,1
"backpack got stolen, pe teacha hates me. yeaa 2010 isnt going so good -_-",4,2,2,2
"We got spirt,  yes we do, We got spirt how 'bout you.... i think i will vomit next time i hear that.",4,3,2,3
"last night with my sweetheart kaitlyn so fun lol. so is the best girl in the world ,)",6,8,3,2
should be looking for a job right now.,5,4,1,1
didn't get nothin done i said i was today..... still got jr !!!!!... (bullshit !!!!!) at least it should be different 2marrow !!!! (i hope !!!!!),4,5,7,9
I'm back! And not a moment too soon,5,5,4,5
Has too catch them all! Want to trade a Bullbasaur for a Weezing?...................well answer me foo.,5,5,4,4
YEY I got to miss swim practice this afternoon for a doctors appointment!!! :-)),6,7,4,6
"It takes courage and honesty to see ourselves as we really are, but it's the only way to become the kind of people we want to be.",5,5,2,2
I want my girlfriend to be with me right now so we can cuddle,6,5,1,1
i love when the night time comes. i love it.,6,8,2,1
"(, itss been a while since i painted my nails black*",6,6,2,3
im so noob! i cant take this shit!! :(,3,3,4,7
Going to build an igloo and snowman with <PERSON>:) Hahaha yes where still children at heart!,6,7,4,5
had a great weekend I hope everyone else did as well :),7,7,3,2
"happy, got new friends, and lifes getting smoother.",8,8,2,1
Don't you just despise when somebody makes up something just to make u look bad?,4,2,2,1
trust takes year to build and seconds to destroy,5,4,2,1
"Thank you ALL for the wonderful B-Day wishes.  I had an absolutely wonderful day a great dinner alone with my Hubby and have really enjoyed my days off this week.  I could go back to a 4-work day week real quick!  Wishing all of my wonderful friends and family a very happy and safe Christmas.  Congrats <PERSON> on your new little love that now shares a birthday with me ,).  I can't wait to meet her!! XOXO",8,9,5,5
guess wt? i changed my perofile picture!.... again . whoo! big shocker there ddn't c dat 1 comin'. bt mabe this picture is better than all d kristen photos i've had...atleast i think so.,6,5,4,5
Thanks for the LOVE guys.  I had an AWESOME Birthday.  Im 28 years wise!  LOVE YALL!!!!,7,9,6,7
"i run over a fork on ur car, coz im a ninja!! lol",5,5,5,5
NMCMLL its hard and stoof...,5,4,2,3
man who knew drawing could be so fun...and tireing at the same time life is good though,5,7,2,3
"According to Urbandictionary.com: <PERSON>=1. a person who uses the services of a prostitute          2. a very extremely confusing guy. shows that he has feelings for you sometimes, but then might just randomly stop talking to you at any time. very flirtatious. manwhore. will lead you on. hilarious. full of charisma. you have to love him. boys are jealous of him. girls are jealous of the girl he is flirting with",5,5,1,1
Capricorn A journey of self-improvement ends almost before it starts when you find out there's a kind of waffle stuffed with cheese and booze.,5,5,2,1
The best thing about me is you...,6,7,1,3
is excited to see friends and family we will be in florence the 21-23 then the rest of our time we will be in raleigh/middleof nowwhereville it will be fun!,6,7,5,5
wants out....again.,4,3,1,3
"Went in to hospital for a few hours, but they stopped the contractions.  I still don't know if that's good or bad, lol.  I'm 34 1/2 weeks, so it is still a little early...guess we'll wait :)  Besides, I don't want to share my birthday with anyone!!",6,6,5,5
Ik im dumb but u gotta love me... u gotta love me right? xD,5,6,4,4
I love you mom. I dont want you to go but it hurts to see you live in such pain.,3,2,4,1
Chouiefat People that thinks mr.<PERSON> teaches better football than our school he is wrong i won yesterday 2 boys 10-1,5,5,2,1
"not sure if this is bad parenting (or over-care) but i think aidan has a dickie do\ and it is adorable! i love round bellies on toddlers!!! LOL!\""""",6,7,6,7
went to a beautiful wedding today :) all of my friends are getting married.,6,7,3,3
"I'm 34 years old and I still don't understand a lot of things, but i'm cool with who I  am.",6,8,3,1
Loved Aisha !!! Its soooo like Delhi................,6,7,6,6
just got back from the dew tour! got to chill with ryan sheckler and a bunch more pro skaters,6,6,5,4
"is enjoying my last day of leave :(... Working on my new song before I get back to morrow to sort out Project Awards, Photo Competition Bridge Building and writing my new article for CE magazine...",5,4,2,4
Thanks to all for your birthday wishes....xxxxx,6,7,3,2
i need a massage......,5,5,1,3
went to juniper last night had a good time with the jeep. got rained on and was soaked when I got home,6,6,2,1
It's going to be a long day tomorrow....,5,5,1,3
will this yr ever end.   Lord knows.  hopefully something will happed for the good of all of us. Lets keep smiles and uplifting spirits and maybe it will turn out for the best for all,6,6,2,1
why cant this all just end and go away!! its not worth all the tears,4,1,6,6
Be Who You Are and Say What You Feel Because Those Who Mind Don't Matter and Those Who Matter Don't Mind. -- Dr. Seuss,6,6,1,1
It takes 7 secs for food to pass from mouth to stomach. A human hair can hold 3 kg. The length of a penis is 3 times the length of the thumb. The femur is as hard as concrete. A woman's heart beats faster than a man's. Women blink twice as much as men. We use 300 muscles just to keep our balance when we stand. The woman has read this entire text. The man is still looking at his thumb. Repost if this made you smile!,5,6,3,4
"Cus you thought you'd win, 	but I'd knew you'd lose, 	Honey, I'm flyer than altitude cruise,",5,5,1,1
Crisis! I have run out of Marmite!!!! :-(,5,4,6,7
who in the world is Mouhamed Ali Mido?????? hes kinda creepy,4,4,5,5
The best part of 'Kites' was the trailer of 'I Hate Luv Storys'...................... Want my money back  :-(,4,4,3,3
Good game guys! We finally won by more then one goal and it put us in the semis :),6,7,5,4
"Oh my goodness!!!! I love my boyfriend!!! He's so nice, and wonderful, and thoughtful!!! And when I'm sad, he always cheers me right up!!!! I haven't felt this happy in soooo long!!!!!",7,9,9,9
Its hard to understand that the one who hurt you is the one you trusted most...huhuhuhu....sori for me!!!!!!!,4,2,6,8
I'M SO BORED! NUTHINZ ON MY MIND,4,4,5,7
"Wow, <PERSON>, what a jackass.  Seriously?  You doubt evolution and mock the proven facts of the missing links leading to humanity.  You sir are an asshole.  Last time I checked, I haven't actually seen 'God' kickin around my neighborhood lately.  I guess fiction, I'm sorry the bible, is more important than nonfiction these days...",4,2,6,4
Friends are angels who lift us to our feet when our wings have trouble remembering how to fly.......!!<3<3,6,9,4,6
To all my friends who had Restaurant City..Please please gift my friend Donny Chan please..,5,5,2,3
is drinking australian <PERSON>to try how it helps under sleepless,5,5,1,1
H1N1 Visits FAFB...How do you feel about it?,5,5,1,3
bejeweled blitz!!  =],6,7,5,6
here comes the weekend.... but no plans :(,4,3,3,4
The roof! The roof! the roof of walmart's on fire!......Hahahaha,5,5,6,5
Baking cookies!! (= I love the 4th,7,7,6,6
UGLY uniforms!!!!!!!!!!!!!!!!! We look as bad as we play.,4,2,9,8
"if you knew what was on my mind, you'd be begging for a safety room with the jacket that makes u hug yourself!!!",4,4,6,7
it is raining,5,5,1,1
is a lover not a fighter.. but he's a fighter too so don't get any ideas,5,5,2,3
nice day maybe i should do something.........nah,5,5,1,2
"Oh god, i think i'm going to die no computer. :<",4,4,2,3
Consumed by anger.,4,2,1,1
im so good at sleep i can do it with my eyes closedÃ¢â‚¬Å’,5,5,1,1
check out what's new in my profile... give me a buzz... =),6,6,3,3
"My father once told me, We are always dying",4,3,2,1
"liver,bacon,onions mash and gravy mmmm",6,6,2,2
"is in Palm Coast, Florida :)",6,6,3,2
"not yet done with my APE... having lunch with Dadi Jay in Pepper Lunch, EDSA Shangri-la",5,5,1,1
i finally finished my project!!! . . . but i still got tutor homework ='[,5,4,6,6
Goodnight.,5,5,1,1
What to do? What to do?,5,5,1,3
"Life has handed me a fare share of lemons. I have decided to make grape juice with them, then stand back and watch everyone wonder how the hell I did it.. :)c",6,7,2,3
so excited... getting hibachi later!!!,7,6,7,7
thinks it's weird that Facebook deleted half of his wall...,5,4,2,3
Is drowning in work =(,4,3,1,2
LOST 20lbs JUST NEED TO LOSE 40 MORE,5,6,4,3
whats going on today? its 11 am and im already bored. Hit me up,5,4,2,1
Thanks for the b-day wishes to all,6,5,2,1
"Everything we hear is an opinion, not a fact. Everything we see is a perspective, not the truth",5,5,1,1
Wow!first day of scol,5,5,3,5
"Before you criticize someone,	 you should walk a mile in their shoes. That way, when you criticize 	them, you're a mile away and you have their shoes.",5,5,2,1
nite nite my sweet fb nite owls!,6,6,4,5
"so we got to elkins high school late, had to set up with all the middle school already there, played a good concert, waited around for about a half an hour, played another one, went to walmart, got free food, went back, packed up, and went home, it was a looonnnggggg day!!!!! :D",6,7,7,7
Merry Christmas to all and to all a good night!,6,6,5,5
is wanting to go white-water rafting this summer in Colorado! Who wants to join me for some fun?,6,6,5,4
missing my girls!!!!,4,4,7,6
Giving in to nostalgia,5,5,2,1
can't wait to kick ass at kickboxing tonight!,6,6,6,5
I am getting ready to go out in the real world and cut me some trees..... can someone please ask someone in charge to pay the heat bill?  it's a little chilly!!!!,5,4,6,6
"goal number 1, graduate school and get a job:CHECK been there done that. Goal number 2, become fluent in spanish and star in a spanish soap opera: in progress",5,5,2,1
Watching Lost Boys and being all mopey.....,5,4,2,2
"Listening to Judas Priest, drinking Jameson whiskey, and updating facebook.",5,5,1,1
Thank you all for the birthday wishes!!!,6,6,6,6
"Please hold, your status messages are important to me.",5,5,2,1
HEHEHEHAHAHA lol. Just got my new carrr!!!  So excited!!,6,7,6,8
People change I guess... Things they couldn't do before they can do now... Not because of you but because of others... Just because you're happy for them doesn't mean you can't be a little hurt because you've been left behind... Forgotten :(,4,2,2,3
Wow,5,5,1,2
live today,5,5,1,1
"Just got my aftercare call from my tattoo artist. Awww, he even asked about my car, too kind! Tattoo is fine, car is still sick but at the Dr's. (Deep Breath) Favor Lord? More More More Favor",6,5,3,3
"boooooooooooooooooooooooored, what the faaaaaack",4,4,2,4
thank you for all the birthday wishes! i love you all<3,7,8,6,5
"I hate living in a society where torturing one animal is cruelty, but torturing many animals is science.",4,2,2,3
Heard blues by the bay from my house... Did a ton of laundry. Did a dump run.. And went to my moms and stacked wood. Now i'm helping fold 10baskets of cloth.,5,5,1,1
thanks everyone for the birthday greetings,6,5,2,1
My stomach was making the rumblies        <PERSON>     That only hand would satisfy,5,5,1,1
trevwon't go too bed,4,5,1,1
oh so tirrred.. to behave? or not to behave........,5,5,1,2
Thanks to all for my birthday wishesssssss,7,5,4,3
"Totally psyched! Just registered for the Wedding Planners Institute of CanadaÃ¢â‚¬â„¢s June 26th & 27th, 2010 course!",6,6,6,5
Huhuuh :( skool holidays is ending soon! So soon!,4,3,5,5
wants to thank all her buddies for the birthday wishes. thank you all.,7,5,3,1
Fell asleep way too early dude now im up!,5,5,4,4
i only want positive news on fb from now on everybody cheer up,6,5,1,3
"There are as many nights as        days, and the one is just as long as the other in the year's course.        Even a happy life cannot be without a measure of darkness, and the word        'happy' would lose its meaning if it were not balanced by sadness..",4,6,1,1
thinks its time that she starts designing 'Man'...!!,6,5,4,5
PISS N LOVE,5,5,4,5
i wasn't the son my father wanted,2,1,1,1
Love is a kind of torment as a lover should endure,5,5,2,1
If we dont fight for what we believe in what would be the point of living? Use your voice and stand up for something!,6,6,5,5
Is addled due to his ''sweet tooth'' and wishes the ants were here. *_*,5,4,3,2
who hates me thumbs up?,5,3,2,1
wow! i absolutly live in a house w/damn fools  i got one on the for talkin to me on the phone and she aint even related idr y she was i got one in the room screamin bitchin for that reason she was phone then i got one damn that aint nobody listen to askin who i'm on the phone with no yo damn bidness god! what am i gon do and i'm still half awake,4,1,5,5
I'm kinda sad I keep missing episodes of America The Story of Us on the History Channel. It's truly a Greek tragedy.,4,4,2,1
I am a nutjobbbbbbbbbbbbbbbbbbbbbb,4,4,4,4
"Let's see who is paying attention. Every single one of you are on my friends list, as a result of a conscious decision. I wanted you there! I am not only glad to count you as friends, but also as family. Let's see who on my friends' list actually pays attention. Copy and paste this as .........your......status.... I'll be watching to see who repost and comments.",5,7,1,3
Am I the only one who thinks valentines day isn't that bad?,5,5,2,2
cs61a blows my mind every week.,5,5,1,1
Awww Mann...,5,4,1,3
won 20 dollars from a 1 dollar lottery ticket and I plan to use it for food.,6,5,1,1
Makin garlic bread for dinner... Yummm :3 <-suchahippie<3->,7,6,2,4
"Anyone who knows someone who has had cancer, should check this documentary out, very interesting. Its called The Beautiful Truth\. 		<URL>""""",5,5,1,1
Things are starting to look up... :),7,7,2,4
boycott <PERSON> for she needs her sleep to get through her high fever.,4,5,2,1
"ugh, i dnt wanna go to class tonight!!!!!!!!",4,4,8,9
me sore everywhere T____T,4,4,1,3
I love Daniel with aaaaaaaaaaalllllllllllll of my heart :):):) Love<PERSON> xxxxx,8,8,5,5
wtf??? Wagner??? go home!!!!,4,4,6,8
great birthday-great friends-i'm such a lucky girl---zoo today!,7,8,5,5
..................................................:P,5,6,1,5
happy birthday lolo nonito!!!!!!!!!!!!!!!!!!!!!!!!!!!!!,7,6,7,9
grr...I hate being sick!,4,3,6,5
